{
  "name": "Daily Backup Job",
  "url": "https://uptime.betterstack.com/api/v1/heartbeat/abc123",
  "period": 86400,
  "grace": 3600,
  "status": "up",
  "call": false,
  "sms": false,
  "email": true,
  "push": true,
  "created_at": "2025-06-01T00:00:00Z",
  "updated_at": "2026-04-01T00:00:00Z",
  "paused_at": "2026-04-19T10:00:00Z"
}